Auto_tune/log/gpu/onnx/8batch/gpu_onnx_8batch_resnet101.log
{"i": ["cuda -model=unknown", "topi_nn_conv2d", [["TENSOR", [8, 1024, 14, 14], "float32"], ["TENSOR", [2048, 1024, 1, 1], "float32"], [2, 2], [0, 0], [1, 1], "NCHW", "float32"], {}, ["conv2d", [8, 1024, 14, 14, "float32"], [2048, 1024, 1, 1, "float32"], [2, 2], [0, 0], [1, 1], "NCHW", "float32"], {"i": 271352, "t": "direct", "c": null, "e": [["tile_f", "sp", [-1, 2, 8, 4]], ["tile_y", "sp", [-1, 7, 1, 1]], ["tile_x", "sp", [-1, 1, 7, 1]], ["tile_rc", "sp", [-1, 4]], ["tile_ry", "sp", [-1, 1]], ["tile_rx", "sp", [-1, 1]], ["auto_unroll_max_step", "ot", 512], ["unroll_explicit", "ot", 1]]}], "r": [[0.00048100487575757577], 0, 3.629833459854126, 1589365157.1456928], "v": 0.1}
{"i": ["cuda -model=unknown", "topi_nn_conv2d", [["TENSOR", [8, 512, 28, 28], "float32"], ["TENSOR", [1024, 512, 1, 1], "float32"], [2, 2], [0, 0], [1, 1], "NCHW", "float32"], {}, ["conv2d", [8, 512, 28, 28, "float32"], [1024, 512, 1, 1, "float32"], [2, 2], [0, 0], [1, 1], "NCHW", "float32"], {"i": 1667487, "t": "direct", "c": null, "e": [["tile_f", "sp", [-1, 2, 32, 2]], ["tile_y", "sp", [-1, 1, 7, 1]], ["tile_x", "sp", [-1, 1, 1, 7]], ["tile_rc", "sp", [-1, 4]], ["tile_ry", "sp", [-1, 1]], ["tile_rx", "sp", [-1, 1]], ["auto_unroll_max_step", "ot", 1500], ["unroll_explicit", "ot", 0]]}], "r": [[0.000394313826619965], 0, 14.177464962005615, 1589365908.65504], "v": 0.1}
{"i": ["cuda -model=unknown", "topi_nn_conv2d", [["TENSOR", [8, 256, 56, 56], "float32"], ["TENSOR", [512, 256, 1, 1], "float32"], [2, 2], [0, 0], [1, 1], "NCHW", "float32"], {}, ["conv2d", [8, 256, 56, 56, "float32"], [512, 256, 1, 1, "float32"], [2, 2], [0, 0], [1, 1], "NCHW", "float32"], {"i": 874874, "t": "direct", "c": null, "e": [["tile_f", "sp", [-1, 1, 8, 8]], ["tile_y", "sp", [-1, 2, 14, 1]], ["tile_x", "sp", [-1, 2, 1, 2]], ["tile_rc", "sp", [-1, 4]], ["tile_ry", "sp", [-1, 1]], ["tile_rx", "sp", [-1, 1]], ["auto_unroll_max_step", "ot", 0], ["unroll_explicit", "ot", 0]]}], "r": [[0.0009270264132231404], 0, 1.8854479789733887, 1589366108.9720497], "v": 0.1}
{"i": ["cuda -model=unknown", "topi_nn_conv2d", [["TENSOR", [8, 3, 224, 224], "float32"], ["TENSOR", [64, 3, 7, 7], "float32"], [2, 2], [3, 3], [1, 1], "NCHW", "float32"], {}, ["conv2d", [8, 3, 224, 224, "float32"], [64, 3, 7, 7, "float32"], [2, 2], [3, 3], [1, 1], "NCHW", "float32"], {"i": 49834277, "t": "direct", "c": null, "e": [["tile_f", "sp", [-1, 16, 4, 1]], ["tile_y", "sp", [-1, 1, 4, 4]], ["tile_x", "sp", [-1, 1, 16, 1]], ["tile_rc", "sp", [-1, 1]], ["tile_ry", "sp", [-1, 7]], ["tile_rx", "sp", [-1, 7]], ["auto_unroll_max_step", "ot", 0], ["unroll_explicit", "ot", 1]]}], "r": [[0.00024418379626972743], 0, 13.897727727890015, 1589366724.2216322], "v": 0.1}
{"i": ["cuda -model=unknown", "topi_nn_conv2d", [["TENSOR", [8, 64, 56, 56], "float32"], ["TENSOR", [64, 64, 1, 1], "float32"], [1, 1], [0, 0], [1, 1], "NCHW", "float32"], {}, ["conv2d", [8, 64, 56, 56, "float32"], [64, 64, 1, 1, "float32"], [1, 1], [0, 0], [1, 1], "NCHW", "float32"], {"i": 5531277, "t": "direct", "c": null, "e": [["tile_f", "sp", [-1, 4, 8, 2]], ["tile_y", "sp", [-1, 1, 2, 1]], ["tile_x", "sp", [-1, 7, 8, 1]], ["tile_rc", "sp", [-1, 8]], ["tile_ry", "sp", [-1, 1]], ["tile_rx", "sp", [-1, 1]], ["auto_unroll_max_step", "ot", 512], ["unroll_explicit", "ot", 0]]}], "r": [[3.6513145488980714e-05], 0, 3.9244844913482666, 1589367843.6691399], "v": 0.1}
{"i": ["cuda -model=unknown", "topi_nn_conv2d", [["TENSOR", [8, 256, 56, 56], "float32"], ["TENSOR", [64, 256, 1, 1], "float32"], [1, 1], [0, 0], [1, 1], "NCHW", "float32"], {}, ["conv2d", [8, 256, 56, 56, "float32"], [64, 256, 1, 1, "float32"], [1, 1], [0, 0], [1, 1], "NCHW", "float32"], {"i": 21342851, "t": "direct", "c": null, "e": [["tile_f", "sp", [-1, 2, 16, 2]], ["tile_y", "sp", [-1, 2, 1, 1]], ["tile_x", "sp", [-1, 1, 14, 4]], ["tile_rc", "sp", [-1, 8]], ["tile_ry", "sp", [-1, 1]], ["tile_rx", "sp", [-1, 1]], ["auto_unroll_max_step", "ot", 512], ["unroll_explicit", "ot", 1]]}], "r": [[0.0001377962961130742], 0, 2.1721067428588867, 1589369039.5147657], "v": 0.1}
{"i": ["cuda -model=unknown", "topi_nn_conv2d", [["TENSOR", [8, 64, 56, 56], "float32"], ["TENSOR", [64, 64, 3, 3], "float32"], [1, 1], [1, 1], [1, 1], "NCHW", "float32"], {}, ["conv2d", [8, 64, 56, 56, "float32"], [64, 64, 3, 3, "float32"], [1, 1], [1, 1], [1, 1], "NCHW", "float32"], {"i": 1792604, "t": "winograd", "c": null, "e": [["tile_b", "sp", [-1, 1, 1, 1]], ["tile_y", "sp", [-1, 2, 8, 2]], ["tile_x", "sp", [-1, 7, 8, 1]], ["tile_rc", "sp", [-1, 8]], ["auto_unroll_max_step", "ot", 1500], ["unroll_explicit", "ot", 1]]}], "r": [[0.0001604522924302789], 0, 3.7935707569122314, 1589370262.7048323], "v": 0.1}
{"i": ["cuda -model=unknown", "topi_nn_conv2d", [["TENSOR", [8, 64, 56, 56], "float32"], ["TENSOR", [256, 64, 1, 1], "float32"], [1, 1], [0, 0], [1, 1], "NCHW", "float32"], {}, ["conv2d", [8, 64, 56, 56, "float32"], [256, 64, 1, 1, "float32"], [1, 1], [0, 0], [1, 1], "NCHW", "float32"], {"i": 33044653, "t": "direct", "c": null, "e": [["tile_f", "sp", [-1, 1, 16, 4]], ["tile_y", "sp", [-1, 1, 1, 2]], ["tile_x", "sp", [-1, 7, 8, 1]], ["tile_rc", "sp", [-1, 8]], ["tile_ry", "sp", [-1, 1]], ["tile_rx", "sp", [-1, 1]], ["auto_unroll_max_step", "ot", 512], ["unroll_explicit", "ot", 1]]}], "r": [[0.00014024166091458154], 0, 2.2177610397338867, 1589370544.053651], "v": 0.1}
{"i": ["cuda -model=unknown", "topi_nn_conv2d", [["TENSOR", [8, 256, 56, 56], "float32"], ["TENSOR", [128, 256, 1, 1], "float32"], [1, 1], [0, 0], [1, 1], "NCHW", "float32"], {}, ["conv2d", [8, 256, 56, 56, "float32"], [128, 256, 1, 1, "float32"], [1, 1], [0, 0], [1, 1], "NCHW", "float32"], {"i": 9651779, "t": "direct", "c": null, "e": [["tile_f", "sp", [-1, 2, 16, 2]], ["tile_y", "sp", [-1, 2, 1, 2]], ["tile_x", "sp", [-1, 1, 14, 2]], ["tile_rc", "sp", [-1, 8]], ["tile_ry", "sp", [-1, 1]], ["tile_rx", "sp", [-1, 1]], ["auto_unroll_max_step", "ot", 512], ["unroll_explicit", "ot", 0]]}], "r": [[0.00023353682352941177], 0, 4.092794179916382, 1589371179.4263787], "v": 0.1}
{"i": ["cuda -model=unknown", "topi_nn_conv2d", [["TENSOR", [8, 128, 56, 56], "float32"], ["TENSOR", [128, 128, 3, 3], "float32"], [2, 2], [1, 1], [1, 1], "NCHW", "float32"], {}, ["conv2d", [8, 128, 56, 56, "float32"], [128, 128, 3, 3, "float32"], [2, 2], [1, 1], [1, 1], "NCHW", "float32"], {"i": 23310983, "t": "direct", "c": null, "e": [["tile_f", "sp", [-1, 4, 8, 1]], ["tile_y", "sp", [-1, 1, 1, 2]], ["tile_x", "sp", [-1, 2, 14, 1]], ["tile_rc", "sp", [-1, 2]], ["tile_ry", "sp", [-1, 3]], ["tile_rx", "sp", [-1, 3]], ["auto_unroll_max_step", "ot", 0], ["unroll_explicit", "ot", 1]]}], "r": [[0.000325757778401122], 0, 7.530429124832153, 1589371740.070621], "v": 0.1}
{"i": ["cuda -model=unknown", "topi_nn_conv2d", [["TENSOR", [8, 512, 28, 28], "float32"], ["TENSOR", [128, 512, 1, 1], "float32"], [1, 1], [0, 0], [1, 1], "NCHW", "float32"], {}, ["conv2d", [8, 512, 28, 28, "float32"], [128, 512, 1, 1, "float32"], [1, 1], [0, 0], [1, 1], "NCHW", "float32"], {"i": 2550079, "t": "direct", "c": null, "e": [["tile_f", "sp", [-1, 1, 8, 4]], ["tile_y", "sp", [-1, 1, 4, 1]], ["tile_x", "sp", [-1, 7, 4, 1]], ["tile_rc", "sp", [-1, 8]], ["tile_ry", "sp", [-1, 1]], ["tile_rx", "sp", [-1, 1]], ["auto_unroll_max_step", "ot", 512], ["unroll_explicit", "ot", 0]]}], "r": [[0.00012383540106141017], 0, 6.506091356277466, 1589372916.5501251], "v": 0.1}
{"i": ["cuda -model=unknown", "topi_nn_conv2d", [["TENSOR", [8, 128, 28, 28], "float32"], ["TENSOR", [128, 128, 3, 3], "float32"], [1, 1], [1, 1], [1, 1], "NCHW", "float32"], {}, ["conv2d", [8, 128, 28, 28, "float32"], [128, 128, 3, 3, "float32"], [1, 1], [1, 1], [1, 1], "NCHW", "float32"], {"i": 1888774, "t": "winograd", "c": null, "e": [["tile_b", "sp", [-1, 1, 1, 1]], ["tile_y", "sp", [-1, 1, 4, 8]], ["tile_x", "sp", [-1, 4, 8, 1]], ["tile_rc", "sp", [-1, 16]], ["auto_unroll_max_step", "ot", 0], ["unroll_explicit", "ot", 1]]}], "r": [[0.00016170970669291337], 0, 25.87347412109375, 1589373645.4597151], "v": 0.1}
{"i": ["cuda -model=unknown", "topi_nn_conv2d", [["TENSOR", [8, 128, 28, 28], "float32"], ["TENSOR", [512, 128, 1, 1], "float32"], [1, 1], [0, 0], [1, 1], "NCHW", "float32"], {}, ["conv2d", [8, 128, 28, 28, "float32"], [512, 128, 1, 1, "float32"], [1, 1], [0, 0], [1, 1], "NCHW", "float32"], {"i": 3971122, "t": "direct", "c": null, "e": [["tile_f", "sp", [-1, 2, 8, 4]], ["tile_y", "sp", [-1, 1, 4, 1]], ["tile_x", "sp", [-1, 7, 4, 1]], ["tile_rc", "sp", [-1, 8]], ["tile_ry", "sp", [-1, 1]], ["tile_rx", "sp", [-1, 1]], ["auto_unroll_max_step", "ot", 512], ["unroll_explicit", "ot", 0]]}], "r": [[0.00012218181555269923], 0, 42.58405017852783, 1589374074.0690558], "v": 0.1}
{"i": ["cuda -model=unknown", "topi_nn_conv2d", [["TENSOR", [8, 512, 28, 28], "float32"], ["TENSOR", [256, 512, 1, 1], "float32"], [1, 1], [0, 0], [1, 1], "NCHW", "float32"], {}, ["conv2d", [8, 512, 28, 28, "float32"], [256, 512, 1, 1, "float32"], [1, 1], [0, 0], [1, 1], "NCHW", "float32"], {"i": 8786374, "t": "direct", "c": null, "e": [["tile_f", "sp", [-1, 1, 8, 8]], ["tile_y", "sp", [-1, 1, 4, 1]], ["tile_x", "sp", [-1, 7, 4, 1]], ["tile_rc", "sp", [-1, 8]], ["tile_ry", "sp", [-1, 1]], ["tile_rx", "sp", [-1, 1]], ["auto_unroll_max_step", "ot", 0], ["unroll_explicit", "ot", 1]]}], "r": [[0.00019649586136177196], 0, 15.747454166412354, 1589374522.255685], "v": 0.1}
{"i": ["cuda -model=unknown", "topi_nn_conv2d", [["TENSOR", [8, 256, 28, 28], "float32"], ["TENSOR", [256, 256, 3, 3], "float32"], [2, 2], [1, 1], [1, 1], "NCHW", "float32"], {}, ["conv2d", [8, 256, 28, 28, "float32"], [256, 256, 3, 3, "float32"], [2, 2], [1, 1], [1, 1], "NCHW", "float32"], {"i": 4246166, "t": "direct", "c": null, "e": [["tile_f", "sp", [-1, 8, 2, 2]], ["tile_y", "sp", [-1, 1, 7, 1]], ["tile_x", "sp", [-1, 1, 14, 1]], ["tile_rc", "sp", [-1, 2]], ["tile_ry", "sp", [-1, 3]], ["tile_rx", "sp", [-1, 3]], ["auto_unroll_max_step", "ot", 1500], ["unroll_explicit", "ot", 0]]}], "r": [[0.00043574424497991966], 0, 10.469307899475098, 1589375181.0771499], "v": 0.1}
{"i": ["cuda -model=unknown", "topi_nn_conv2d", [["TENSOR", [8, 1024, 14, 14], "float32"], ["TENSOR", [256, 1024, 1, 1], "float32"], [1, 1], [0, 0], [1, 1], "NCHW", "float32"], {}, ["conv2d", [8, 1024, 14, 14, "float32"], [256, 1024, 1, 1, "float32"], [1, 1], [0, 0], [1, 1], "NCHW", "float32"], {"i": 654917, "t": "direct", "c": null, "e": [["tile_f", "sp", [-1, 4, 16, 1]], ["tile_y", "sp", [-1, 2, 1, 1]], ["tile_x", "sp", [-1, 1, 14, 1]], ["tile_rc", "sp", [-1, 16]], ["tile_ry", "sp", [-1, 1]], ["tile_rx", "sp", [-1, 1]], ["auto_unroll_max_step", "ot", 512], ["unroll_explicit", "ot", 0]]}], "r": [[0.00015518760750167447], 0, 1.9532749652862549, 1589376106.437968], "v": 0.1}
{"i": ["cuda -model=unknown", "topi_nn_conv2d", [["TENSOR", [8, 256, 14, 14], "float32"], ["TENSOR", [256, 256, 3, 3], "float32"], [1, 1], [1, 1], [1, 1], "NCHW", "float32"], {}, ["conv2d", [8, 256, 14, 14, "float32"], [256, 256, 3, 3, "float32"], [1, 1], [1, 1], [1, 1], "NCHW", "float32"], {"i": 699672, "t": "winograd", "c": null, "e": [["tile_b", "sp", [-1, 1, 1, 1]], ["tile_y", "sp", [-1, 2, 16, 2]], ["tile_x", "sp", [-1, 4, 14, 1]], ["tile_rc", "sp", [-1, 8]], ["auto_unroll_max_step", "ot", 1500], ["unroll_explicit", "ot", 0]]}], "r": [[0.00015745587690925428], 0, 9.106242656707764, 1589376891.574272], "v": 0.1}
{"i": ["cuda -model=unknown", "topi_nn_conv2d", [["TENSOR", [8, 256, 14, 14], "float32"], ["TENSOR", [1024, 256, 1, 1], "float32"], [1, 1], [0, 0], [1, 1], "NCHW", "float32"], {}, ["conv2d", [8, 256, 14, 14, "float32"], [1024, 256, 1, 1, "float32"], [1, 1], [0, 0], [1, 1], "NCHW", "float32"], {"i": 2968720, "t": "direct", "c": null, "e": [["tile_f", "sp", [-1, 4, 16, 1]], ["tile_y", "sp", [-1, 1, 1, 7]], ["tile_x", "sp", [-1, 1, 14, 1]], ["tile_rc", "sp", [-1, 16]], ["tile_ry", "sp", [-1, 1]], ["tile_rx", "sp", [-1, 1]], ["auto_unroll_max_step", "ot", 512], ["unroll_explicit", "ot", 1]]}], "r": [[0.00014001483942558746], 0, 37.95145535469055, 1589377382.6021109], "v": 0.1}
{"i": ["cuda -model=unknown", "topi_nn_conv2d", [["TENSOR", [8, 1024, 14, 14], "float32"], ["TENSOR", [512, 1024, 1, 1], "float32"], [1, 1], [0, 0], [1, 1], "NCHW", "float32"], {}, ["conv2d", [8, 1024, 14, 14, "float32"], [512, 1024, 1, 1, "float32"], [1, 1], [0, 0], [1, 1], "NCHW", "float32"], {"i": 3353716, "t": "direct", "c": null, "e": [["tile_f", "sp", [-1, 4, 16, 1]], ["tile_y", "sp", [-1, 1, 1, 7]], ["tile_x", "sp", [-1, 1, 14, 1]], ["tile_rc", "sp", [-1, 16]], ["tile_ry", "sp", [-1, 1]], ["tile_rx", "sp", [-1, 1]], ["auto_unroll_max_step", "ot", 1500], ["unroll_explicit", "ot", 1]]}], "r": [[0.0002698616331658291], 0, 21.8216392993927, 1589377784.7162943], "v": 0.1}
{"i": ["cuda -model=unknown", "topi_nn_conv2d", [["TENSOR", [8, 512, 14, 14], "float32"], ["TENSOR", [512, 512, 3, 3], "float32"], [2, 2], [1, 1], [1, 1], "NCHW", "float32"], {}, ["conv2d", [8, 512, 14, 14, "float32"], [512, 512, 3, 3, "float32"], [2, 2], [1, 1], [1, 1], "NCHW", "float32"], {"i": 255901, "t": "direct", "c": null, "e": [["tile_f", "sp", [-1, 2, 32, 1]], ["tile_y", "sp", [-1, 1, 1, 7]], ["tile_x", "sp", [-1, 1, 7, 1]], ["tile_rc", "sp", [-1, 4]], ["tile_ry", "sp", [-1, 3]], ["tile_rx", "sp", [-1, 3]], ["auto_unroll_max_step", "ot", 512], ["unroll_explicit", "ot", 0]]}], "r": [[0.0005438560133333332], 0, 38.86267304420471, 1589378215.8271992], "v": 0.1}
{"i": ["cuda -model=unknown", "topi_nn_conv2d", [["TENSOR", [8, 2048, 7, 7], "float32"], ["TENSOR", [512, 2048, 1, 1], "float32"], [1, 1], [0, 0], [1, 1], "NCHW", "float32"], {}, ["conv2d", [8, 2048, 7, 7, "float32"], [512, 2048, 1, 1, "float32"], [1, 1], [0, 0], [1, 1], "NCHW", "float32"], {"i": 16302, "t": "direct", "c": null, "e": [["tile_f", "sp", [-1, 8, 4, 1]], ["tile_y", "sp", [-1, 1, 7, 1]], ["tile_x", "sp", [-1, 1, 7, 1]], ["tile_rc", "sp", [-1, 16]], ["tile_ry", "sp", [-1, 1]], ["tile_rx", "sp", [-1, 1]], ["auto_unroll_max_step", "ot", 0], ["unroll_explicit", "ot", 0]]}], "r": [[0.00024958670402611534], 0, 3.858872652053833, 1589378724.6872747], "v": 0.1}
{"i": ["cuda -model=unknown", "topi_nn_conv2d", [["TENSOR", [8, 512, 7, 7], "float32"], ["TENSOR", [512, 512, 3, 3], "float32"], [1, 1], [1, 1], [1, 1], "NCHW", "float32"], {}, ["conv2d", [8, 512, 7, 7, "float32"], [512, 512, 3, 3, "float32"], [1, 1], [1, 1], [1, 1], "NCHW", "float32"], {"i": 613441, "t": "winograd", "c": null, "e": [["tile_b", "sp", [-1, 1, 1, 1]], ["tile_y", "sp", [-1, 4, 8, 2]], ["tile_x", "sp", [-1, 4, 16, 1]], ["tile_rc", "sp", [-1, 8]], ["auto_unroll_max_step", "ot", 1500], ["unroll_explicit", "ot", 0]]}], "r": [[0.00015448231306081753], 0, 5.419569253921509, 1589379778.712784], "v": 0.1}
{"i": ["cuda -model=unknown", "topi_nn_conv2d", [["TENSOR", [8, 512, 7, 7], "float32"], ["TENSOR", [2048, 512, 1, 1], "float32"], [1, 1], [0, 0], [1, 1], "NCHW", "float32"], {}, ["conv2d", [8, 512, 7, 7, "float32"], [2048, 512, 1, 1, "float32"], [1, 1], [0, 0], [1, 1], "NCHW", "float32"], {"i": 137991, "t": "direct", "c": null, "e": [["tile_f", "sp", [-1, 4, 8, 1]], ["tile_y", "sp", [-1, 1, 1, 7]], ["tile_x", "sp", [-1, 1, 7, 1]], ["tile_rc", "sp", [-1, 8]], ["tile_ry", "sp", [-1, 1]], ["tile_rx", "sp", [-1, 1]], ["auto_unroll_max_step", "ot", 1500], ["unroll_explicit", "ot", 0]]}], "r": [[0.00016680206999999998], 0, 29.786598443984985, 1589380172.8047585], "v": 0.1}
